2023-10-20,Brave for Windows has been downloading its optional VPN service to some customers’ machines without consent — not a great look for a privacy-focused company.,Brave browser installs a VPN service on Windows whether you want ...,https://www.theverge.com/2023/10/20/23925192/brave-browser-vpn-windows-11,en,The Verge,['Allison Johnson'],"Brave’s privacy-centric browser has been downloading VPN services to some customers’ computers without their consent.
Noted by Ghacks, starting in 2022, downloading Brave to a Windows PC meant you were also downloading the company’s VPN service, regardless of whether you wanted it.
The Firewall + VPN service is an extra paid subscription and would remain dormant unless the user subscribed to it.
The behavior is limited to the Windows version of Brave, and a post on GitHub from the company’s VP of engineering details the current behavior and a plan to change it.
You can check for the VPN services on your machine in the services manager on Windows — they’re labeled as Brave VPN and Brave Wireguard.",160,"['post', 'paid', 'services', 'vpn', 'brave', 'downloading', 'browser', 'behavior', 'github', 'service', 'windows', 'installs']",[],[],[],[],[],[],[],[],[],[],[],[],[],[],[],[],[],[],[],[],[],[],[],[],[],[],[],[],[],[],[],[],[],[],[],[],[],[],[],[],[],[],[],[],[],[],[],[],[],[],[],2023-10-20,0.6722689075630253
2023-11-02,"If you are looking for a wireless router that can seamlessly handle modern online activities simultaneously, consider this special deal.",Feature-heavy WiFi 6 router with built-in VPN is over 30% off with ...,https://www.pcguide.com/deals/feature-heavy-wifi-6-router-with-built-in-vpn-is-over-30-off-with-this-amazon-deal/,en,PC Guide - For The Latest PC Hardware & Tech News,['Jordan Blaize Winter-Roach'],"ASUS RT-AX1800S Dual Band WiFi 6 Extendable Router Subscription-Free Network Security, Parental Control, Built-in VPN, AiMesh Compatible, Gaming & Streaming, Smart Home Best Deals Deal @ Amazon Load moreLet’s delve into its features to see if it’s the right choice for you.
WiFi 6 Support: Enjoy faster speeds and efficient performance with the latest WiFi 6 (802.11ax) standard, perfect for gaming, streaming, and smart home use.
Enjoy faster speeds and efficient performance with the latest WiFi 6 (802.11ax) standard, perfect for gaming, streaming, and smart home use.
Built-in VPN: Boost your privacy with integrated VPN features, connecting to various providers.
Boost your privacy with integrated VPN features, connecting to various providers.",479,"['router', 'wifi', 'amazon', 'builtin', 'smart', '30', 'features', 'asus', 'featureheavy', 'rtax1800s', 'vpn', 'streaming', 'deal', 'gaming', 'security']",[],[],[],[],[],[],[],[],[],[],[],[],[],[],[],[],[],[],[],[],[],[],[],[],[],[],[],[],[],[],[],[],[],[],[],[],[],[],[],[],[],[],[],[],[],[],[],[],[],[],[],2023-11-02,2.0126050420168067
2023-10-16,We looked at the best VPNs on the market for your Apple TV streaming experience.,Best Apple TV VPN Of 2023 – Forbes Advisor,https://www.forbes.com/advisor/business/software/best-vpn-apple-tv/,en,Forbes,"['Jennifer Simonson', 'Updated', 'Oct', 'Rob Watts']","TorGuard is a highly rated VPN that is great for helping Apple TV fans unlock all their favorite programming.
This allows Apple TV viewers to choose a plan that aligns best with their streaming preferences without paying for features they don’t need.
VPN Unlimited is a great choice for Apple TV users for a variety of reasons with one of the most significant being its offering of a dedicated IP address.
This can be particularly beneficial for Apple TV users because streaming services often block shared IP addresses associated with VPNs due to traffic from multiple users.
Apple TV does not natively support VPNs.",885,"['vpn', 'best', 'does', '2023', 'offers', 'free', 'unlimited', 'advisor', 'tv', 'ip', 'apple', 'users']",[],[],[],[],[],[],[],[],[],[],[],[],[],[],[],[],[],[],[],[],[],[],[],[],[],[],[],[],[],[],[],[],[],[],[],[],[],[],[],[],[],[],[],[],[],[],[],[],[],[],[],2023-10-16,3.7184873949579833
2023-11-01,Find lobbies with less skilled opponents on 'Call of Duty: Modern Warfare 3'.,Save 49% on the best VPN for 'Call of Duty: Modern Warfare 3',https://mashable.com/uk/deals/best-vpn-for-call-of-duty-modern-warfare-3,en,Mashable,[],"Find Call of Duty: Modern Warfare 3 lobbies with less skilled opponents with this high-speed VPN.
Call of Duty: Modern Warfare 3 is a revamp of the legendary 2011 game of the same name, and we absolutely cannot wait to play.
This is frustrating, but all is not lost because gamers can use VPNs to get the most out of Call of Duty: Modern Warfare 3.
Do you need a VPN for Call Of Duty: Modern Warfare 3?
Save 49% on the best VPN for gaming.",515,"['duty', 'best', '49', 'vpn', 'warfare', 'vpns', 'gamers', 'save', 'modern', 'expressvpn', 'game', 'gaming']",[],[],[],[],[],[],[],[],[],[],[],[],[],[],[],[],[],[],[],[],[],[],[],[],[],[],[],[],[],[],[],[],[],[],[],[],[],[],[],[],[],[],[],[],[],[],[],[],[],[],[],2023-11-01,2.1638655462184873
2023-11-02,Forbes Advisor Canada pits two virtual private network leaders against each other to let you know which one is best for your purposes.,NordVPN vs. Private Internet Access (2023 comparison) – Forbes ...,https://www.forbes.com/advisor/ca/business/software/nordvpn-vs-private-internet-access/,en,Forbes,"['Leeron Hoory', 'Cassie Bottorff', 'Contributor', 'Updated', 'Nov', 'Aaron Broverman']","When it comes to price, Private Internet Access is considerably cheaper than NordVPN, at $56.94 USD ($78.78 CAD) per year, compared with $67.35 USD ($93.12 CAD) per year.
Private Internet Access also has a substantially higher number of servers and by far the highest of all the VPNs we’ve tested.
NordVPN still has a high number of servers relative to other VPNs at 5,500, but Private Internet Access is a clear winner here.
The number of server locations is a closer comparison, with Private Internet Access at 78 compared to NordVPN’s 60 server locations.
You can check whether NordVPN server locations will match yours on the company’s website.",263,"['2023', 'number', 'private', 'usd', 'comparison', 'access', 'cad', 'vs', 'vpns', 'internet', 'nordvpn', 'locations', 'server']",[],[],[],[],[],[],[],[],[],[],[],[],[],[],[],[],[],[],[],[],[],[],[],[],[],[],[],[],[],[],[],[],[],[],[],[],[],[],[],[],[],[],[],[],[],[],[],[],[],[],[],2023-11-02,1.1050420168067228
2023-10-03,"Artyom Sheikin, a member of the Russian parliament's Federation Council, said on October 3 that the country’s Roskomnadzor media watchdog plans to block virtual private networks (VPNs) across the country as of March 1, 2024.","Russia Plans To Block VPN In March 2024, Member Of Federation Council Says",https://www.rferl.org/a/russia-blocks-vpns-arch-2024-sheikin-meta/32621394.html,en,Radio Free Europe / Radio Liberty,[],"On the other side of the border, Taliban officials have also opened temporary transit camps to assist those returning.
WATCH: Afghan refugees in Pakistan, many having traveled for days, crossed into Afghanistan as a November 1 deadline to leave the country took effect.
Islamabad has vowed to deport an estimated 1.7 million undocumented Afghans living in Pakistan if they don't leave voluntarily.
Just over 129,000 have fled from Khyber Pakhtunkhwa, the provincial Interior Ministry said, while a total of 38,100 have crossed through Chaman in Balochistan Province, border officials there told AFP.
Pakistan is home to more than 4 million Afghan migrants and refugees, about 1.7 million of them undocumented, Islamabad says, although many have lived in Pakistan for their entire lives.",694,"['vpn', 'afghans', 'million', 'member', 'council', 'plans', 'block', 'pakistan', 'taliban', 'leave', 'russia', 'federation', 'rights', 'undocumented', 'officials', 'afghan', '2024', 'border']",[],[],[],[],[],[],[],[],[],[],[],[],[],[],[],[],[],[],[],[],[],[],[],[],[],[],[],[],[],[],[],[],[],[],[],[],[],[],[],[],[],[],[],[],[],[],[],[],[],[],[],2023-10-03,2.9159663865546217
2023-10-30,"Thanks to Steam, in just a few clicks I can buy heartrending Chinese RPGs, intense Japanese shmups that would otherwise only be sold at specialist doujin events, and even official English translations",Steam is hiding a treasure trove of great games you'll tragically ...,https://www.pcgamer.com/6-fantastic-steam-games-you-cant-play-without-a-vpn/,en,PC Gamer,"['Kerry Brunskill', 'Contributing Writer', 'Social Links Navigation']","No matter the country of origin or the language a game's been written in, there is nothing I can't get my hands on.
Well…Steam is extraordinarily open by its competitors' standards, as anyone who's ever imported a region-locked console game will know.
Without using a VPN to change Steam regions, these are the unique PC gaming experiences I'm heartlessly denied from adding to my insurmountable backlog.
(Image credit: Bandai Namco)Okay, so the list is actually seven games, but this is a twofer.
(Image credit: Koei Tecmo)I'm not a big fan of horses.",927,"['play', 'series', 'great', 'games', 'game', 'youll', 'x', 'credit', 'steam', 'tragically', 'japan', 'hiding', 'trove', 'buy', 'treasure', 'koei', 'vpn']",[],[],[],[],[],[],[],[],[],[],[],[],[],[],[],[],[],[],[],[],[],[],[],[],[],[],[],[],[],[],[],[],[],[],[],[],[],[],[],[],[],[],[],[],[],[],[],[],[],[],[],2023-10-30,3.8949579831932772
2023-10-06,"The competition is getting fiercer, and our top five have a new entry. Check out the results from our latest round of testing and see our 2023 VPN rankings.",Our latest VPN tests are over and the rankings have changed,https://www.techradar.com/vpn/our-latest-vpn-tests-are-over-and-the-rankings-have-changed-october-2023,en,TechRadar,"['Andreas Theodorou', 'Mo Harber-Lamond', 'Mike Williams', 'Anthony Spadafora', 'Editor-In-Chief Of', 'Tech Software', 'With Contributions From', 'Social Links Navigation']","The most recent round of VPN testing is complete, and after rigorous analysis and comparisons, we have a new top five best VPN services.
ExpressVPN: the best VPN service in 2023ExpressVPN continues to set the bar in the industry.
ProtonVPN ⭐⭐⭐⭐ A popular free VPN service with a history of advocating for the freedom of the internet.
We have a much more in-depth explanation on our VPN testing methodology page.
Our VPN testing panelMeet the experts behind our VPN deep dives:Andreas Theodorou Social Links Navigation Editor-in-Chief (Tech Software) A privacy purist at heart, Andreas is a VPN expert that believes that the best VPN doesn't have to be the most expensive—it's about what's right for you.",3523,"['service', 'c4', 'iplayer', 'mbps', 'tests', 'best', '9now', 'expressvpn', 'itv', 'changed', 'vpn', 'testing', 'latest', 'rankings']",[],[],[],[],[],[],[],[],[],[],[],[],[],[],[],[],[],[],[],[],[],[],[],[],[],[],[],[],[],[],[],[],[],[],[],[],[],[],[],[],[],[],[],[],[],[],[],[],[],[],[],2023-10-06,14.802521008403362
2023-10-24,Surfshark's protest was held outside during the grand opening of the new Big Tech Giant’s office in Munich. We talked to the VPN provider to know more.,VPN firm lashes out against Big Tech to defend privacy with big pink ...,https://www.techradar.com/computing/cyber-security/vpn-firm-lashes-out-against-big-tech-to-defend-privacy-with-big-pink-pipe,en,TechRadar,"['Chiara Castro', 'Senior Staff Writer', 'Social Links Navigation']","Protect your online data,"" reads Surfshark's message as passers-by stopped to take a selfie in front of the flashy tube.
""Through this potent visual metaphor, our objective was to magnify the existing discourse on online privacy, compelling individuals to assert control over their personal data and bolster their online privacy defenses,"" Survila explained.
These findings get even worse considering that many organizations admit to covering up data breaches, leaving users even more vulnerable to abuses.
""We took it upon ourselves to spotlight the critical issue of data privacy,"" a Survila told me.
""Surfshark is deeply committed to uncovering and reporting on data breaches, leaks, and various pivotal data-driven matters.",661,"['breaches', 'pipe', 'defend', 'pink', 'firm', 'privacy', 'vpn', 'provider', 'survila', 'big', 'data', 'surfshark', 'munich', 'awareness', 'tech', 'lashes', 'online']",[],[],[],[],[],[],[],[],[],[],[],[],[],[],[],[],[],[],[],[],[],[],[],[],[],[],[],[],[],[],[],[],[],[],[],[],[],[],[],[],[],[],[],[],[],[],[],[],[],[],[],2023-10-24,2.777310924369748
2023-10-10,CyberGhost VPN users can now safely browse locally from 100 country locations worldwide. Here's all you need to know.,CyberGhost VPN just expanded its server network,https://www.techradar.com/computing/cyber-security/cyberghost-vpn-just-expanded-its-server-network,en,TechRadar,"['Chiara Castro', 'Senior Staff Writer', 'Social Links Navigation']","One of the best VPN services around has just announced a considerable expansion to its server network.
Now, CyberGhost VPN users can connect to one of its 100 country locations across the world to enjoy boosted anonymity and bypass geo-restrictions with ease—and benefit from even better speed and performance, too.
The new CyberGhost servers are strategically located across South America and Asia.
Short for virtual private network, a VPN is security software that encrypts internet connections and spoofs your real IP address.
Besides the many server locations, CyberGhost's easy-to-use apps come packed with security features, awesome unblocking power, and decent speeds.",530,"['vpn', 'ip', 'cyberghost', 'locations', 'servers', 'users', 'server', 'security', 'network', 'dedicated', 'expanded']",[],[],[],[],[],[],[],[],[],[],[],[],[],[],[],[],[],[],[],[],[],[],[],[],[],[],[],[],[],[],[],[],[],[],[],[],[],[],[],[],[],[],[],[],[],[],[],[],[],[],[],2023-10-10,2.226890756302521
2023-10-09,Police confiscate ‘illegal income’ of developer deemed to have used ‘unauthorised channels’ to connect to international networks,Chinese programmer ordered to pay 1m yuan for using virtual private network,https://www.theguardian.com/world/2023/oct/09/chinese-programmer-ordered-to-pay-1m-yuan-for-using-virtual-private-network,en,The Guardian,['Amy Hawkins'],"A programmer in northern China has been ordered to pay more than 1m yuan to the authorities for using a virtual private network (VPN), in what is thought to be the most severe individual financial penalty ever issued for circumventing China’s “great firewall”.
The notice said Ma had used “unauthorised channels” to connect to international networks to work for a Turkish company.
The police confiscated the 1.058m yuan (£120,651) Ma had earned as a software developer between September 2019 and November 2022, describing it as “illegal income”, as well as fining him 200 yuan (£23).
“I stated that I was currently working for an overseas company, and my personal Twitter only occasionally liked and retweeted the company’s tweets,” Ma wrote.
In Chengde, the city’s revenues from forfeitures reached nearly 990m yuan in 2022, a year-on-year increase of more than 7%.",682,"['network', 'ordered', 'private', 'work', 'virtual', 'ma', 'twitter', 'using', 'yuan', 'programmer', 'china', '1m', 'chinese', 'access', 'software', 'vpn', 'vpns', 'pay', 'wrote']",[],[],[],[],[],[],[],[],[],[],[],[],[],[],[],[],[],[],[],[],[],[],[],[],[],[],[],[],[],[],[],[],[],[],[],[],[],[],[],[],[],[],[],[],[],[],[],[],[],[],[],2023-10-09,2.865546218487395
2023-11-01,India is finally releasing Takeshi’s Castle reboot dubbed in Hindi. Know how to watch all the latest episodes in India and around the world using a VPN.,How to Watch Takeshi's Castle Latest Episodes – Forbes Advisor ...,https://www.forbes.com/advisor/in/business/software/how-to-watch-takeshis-castle/,en,Forbes,"['Nikita Tambe', 'Forbes Staff', 'Updated', 'Nov', 'Aashika Jain']","Don’t forget to stream all the latest Takeshi’s Castle episodes on November 2, 2023.
of servers 3,200+ Buy Now On Surfshark's secure websiteHow to Watch Watch Takeshi’s Castle in the UKTakeshi’s Castle is not available in the UK for Prime subscribers.
How to Watch Watch Takeshi’s Castle in IndiaIndia is going to host the second season of the world-famous gaming show, Takeshi’s Castle only on Amazon Prime Video on November 2, 2023.
How to Watch Watch Takeshi’s Castle in CanadaTakeshi’s Castle is not available in Canada for Prime subscribers.
How to Watch Watch Takeshi’s Castle in SingaporeTakeshi’s Castle will soon be available for Prime subscribers of Amazon Prime Video.",1705,"['vpn', 'castles', 'episodes', 'castle', 'gaming', 'takeshis', 'watch', 'inr', 'monthly', 'prime', 'india', 'best', 'latest']",[],[],[],[],[],[],[],[],[],[],[],[],[],[],[],[],[],[],[],[],[],[],[],[],[],[],[],[],[],[],[],[],[],[],[],[],[],[],[],[],[],[],[],[],[],[],[],[],[],[],[],2023-11-01,7.163865546218488
2023-10-26,Three reasons to embrace universal ZTNA is a webinar from Zscaler. Get a customizable ZTNA adoption roadmap that fits into your organization’s IT plans,Beyond the VPN: The emerging uses and benefits of ZTNA,https://www.itpro.com/security/beyond-the-vpn-the-emerging-uses-and-benefits-of-ztna,en,ITPro,['Social Links Navigation'],"Interest in zero trust security initiatives is at an all-time high.
Have you looked beyond replacing your VPN with ZTNA?
While that is a great first step, it’s time to up your zero trust game with Zscaler Private Access (ZPA).
Zscaler's showcasing a roadmap to ZTNA adoption that is customizable to fit your organization and IT plans.
Watch this on-demand webinar to learn:Why it’s time to look beyond VPN with ZTNASteps to mature your zero trust journeyHow ZPA delivers comprehensive security for your workforceWatch now.",123,"['benefits', 'access', 'uses', 'zscaler', 'emerging', 'trust', 'zero', 'security', 'zpaprovide', 'ztnasteps', 'vpn', 'zpa', 'ztna']",[],[],[],[],[],[],[],[],[],[],[],[],[],[],[],[],[],[],[],[],[],[],[],[],[],[],[],[],[],[],[],[],[],[],[],[],[],[],[],[],[],[],[],[],[],[],[],[],[],[],[],2023-10-26,0.5168067226890757
2023-10-27,"Learn how using a VPN can easily help you with anonymous crypto trading. Make crypto trading safe, secure, and anonymous with a reliable VPN provider.",Anonymous Crypto Trading: How VPNs Can Help,https://www.analyticsinsight.net/anonymous-crypto-trading-how-vpns-can-help/,en,Analytics Insight,['Market Trends'],"IntroductionPrivacy is essential when it comes to crypto trading.
And when you’re crypto trading, a VPN (Virtual Private Network) comes in handy.
AstrillVPN is our top pick for investing in crypto trading as it has all the essential features needed for crypto trading, which include:Security should be your topmost priority when you’re trading crypto.
AstrillVPN also has a strict No Logs Policy, which is crucial when crypto trading.
AstrillVPN has all the necessary components required to help you with crypto trading.",1212,"['privacy', 'data', 'youre', 'transactions', 'vpns', 'exchanges', 'help', 'trading', 'vpn', 'crypto', 'anonymous', 'sensitive']",[],[],[],[],[],[],[],[],[],[],[],[],[],[],[],[],[],[],[],[],[],[],[],[],[],[],[],[],[],[],[],[],[],[],[],[],[],[],[],[],[],[],[],[],[],[],[],[],[],[],[],2023-10-27,5.092436974789916
2023-10-26,"The internet is the single most significant invention of our times, but do you know how it came to be? Deep dive into its development and evolution with CyberGhost VPN.",The History of the Internet – How the Web Started and Evolved,https://www.cyberghostvpn.com/en_US/privacyhub/history-of-the-internet/,en,CyberGhost VPN,"['Kelly Damon', 'Follow Me']","It marked the first successful computer network in history, and set the stage for the internet as we know it.
Now, there are more than a billion websites online, not counting individual user pages, profiles and channels.
This all changed with WebCrawler, the first public search engine able to find any word on any page and yield results based on user searches.
Google is also the most visited website and holds 99% of search engine market share.
If the history of the internet teaches us anything, it’s that the web is unpredictable and we can’t guess what the future might hold.",2695,"['evolved', 'started', 'websites', 'online', 'internet', 'saw', 'computer', 'web', 'world', 'search', 'engine', 'computers', 'history']",[],[],[],[],[],[],[],[],[],[],[],[],[],[],[],[],[],[],[],[],[],[],[],[],[],[],[],[],[],[],[],[],[],[],[],[],[],[],[],[],[],[],[],[],[],[],[],[],[],[],[],2023-10-26,11.323529411764707
2023-10-26,"Halloween draws ever closer, so it’s time to find out how and where to watch 'Nightmare Before Christmas' around the world.",How & Where to Watch Nightmare Before Christmas in 2023,https://www.cloudwards.net/where-to-watch-nightmare-before-christmas/,en,Cloudwards,"['Kit Copson', 'Writer', 'Briefing Editor', 'Read Their Full Bio', 'Sandra Pattison', 'Alison Spedale']","How & Where to Watch Nightmare Before Christmas From Anywhere in 2023: Travel to Halloween Town With a VPN It’s that time of year again, so grab a blanket and a cup of tea and settle in while we explain how and where to watch 'Nightmare Before Christmas' and how a VPN works with streaming services if you need one.
Key Takeaways: How to Watch Nightmare Before Christmas Online You can stream ‘The Nightmare Before Christmas’ on Disney Plus, which is supported in various locations but not everywhere.
If this sounds like you, you can find out how and where to watch ‘Nightmare Before Christmas’ in this guide.
Where to Watch Nightmare Before Christmas You can watch ‘The Nightmare Before Christmas’ on Disney Plus.
FAQ: Watch The Nightmare Before Christmas Is Nightmare Before Christmas Streaming on Anything?",1402,"['2023', 'watch', 'country', 'nightmare', 'netflix', 'vpn', 'christmas', 'available', 'disney', 'plus', 'streaming']",[],[],[],[],[],[],[],[],[],[],[],[],[],[],[],[],[],[],[],[],[],[],[],[],[],[],[],[],[],[],[],[],[],[],[],[],[],[],[],[],[],[],[],[],[],[],[],[],[],[],[],2023-10-26,5.890756302521009
2023-09-25,"In this article, we will explore some of the common reasons why a VPN is not connecting, from simple fixes that can be addressed to more complex problems.",VPN Not Connecting? Try These Simple Fixes,https://www.forbes.com/advisor/business/vpn-not-connecting/,en,Forbes,"['Kiran Aditham', 'Updated', 'Sep']","Contact VPN support: If you’ve tried all the above steps and still can’t connect, reach out to your VPN provider’s support.
How To Fix VPN Connection on DesktopBy approaching VPN connection issues on your desktop with a systematic method, you can isolate and address the underlying problem.
Reconfigure VPN settings: Check the configuration settings within your VPN client.
Review VPN configuration settings: Log in to the router’s administrative panel and carefully review the VPN settings.
Change VPN server or protocol: Try connecting to a different VPN server or change the connection protocol.",1533,"['router', 'wifi', 'settings', 'try', 'connection', 'fixes', 'vpn', 'issues', 'simple', 'support', 'server', 'connecting']",[],[],[],[],[],[],[],[],[],[],[],[],[],[],[],[],[],[],[],[],[],[],[],[],[],[],[],[],[],[],[],[],[],[],[],[],[],[],[],[],[],[],[],[],[],[],[],[],[],[],[],2023-09-25,6.4411764705882355
2023-09-29,Wondering how to know if your VPN is working as it should? Here are seven methods to test it out.,How To Check If Your VPN Is Working,https://www.forbes.com/advisor/business/how-check-vpn-working/,en,Forbes,"['Monique Danao', 'Cassie Bottorff', 'Contributor', 'Matt Hoeper', 'Published', 'Sep']","Open your VPN client and connect to a VPN server.
Check Your VPN StatusNaturally, you’ll want to check the status of your VPN to verify whether it’s functioning correctly.
Check if Your VPN Connection Is BlockedSome websites restrict VPN users from accessing their content.
Check for connection failures: When establishing a VPN connection, note any error messages or connection failures.
Consult your VPN provider: If you suspect your VPN connection is blocked, contact the customer support team.",1213,"['dns', 'ip', 'check', 'leak', 'working', 'server', 'connection', 'speed', 'internet', 'website', 'vpn', 'address']",[],[],[],[],[],[],[],[],[],[],[],[],[],[],[],[],[],[],[],[],[],[],[],[],[],[],[],[],[],[],[],[],[],[],[],[],[],[],[],[],[],[],[],[],[],[],[],[],[],[],[],2023-09-29,5.0966386554621845
2021-12-07,"Consumer Reports explains when you should use a VPN, when you may not want a VPN, and some tips for staying safe while using one.",Should You Use a VPN?,https://www.consumerreports.org/electronics-computers/vpn-services/should-you-use-a-vpn-a5562069524/,en,Consumer Reports,"['Yael Grauer', 'I Am An Investigative Tech Reporter Covering Digital Privacy', ""Security. I'M The Lead Content Creator Of""]","Some people may want to use a VPN to try to hide their identity or location from websites they connect to.
Without a VPN, your ISP can see what sites you visit, how long you’re on them, and information about your devices.
While using a VPN means all that information is hidden from your ISP, the VPN provider can see it all instead.
But on the other hand, transferring that data and trust onto a random, unverified commercial VPN provider, might be even worse,” said Reethika Ramesh, PhD candidate at the University of Michigan and lead researcher at VPNalyzer, an interdisciplinary research project headed by professor Roya Ensafi that aims to analyze the VPN ecosystem.
And these VPN providers subject themselves to independent third-party security audits and publish the results.",601,"['vpn', 'vpns', 'data', 'provider', 'websites', 'information', 'location', 'sites', 'theres', 'security']",[],[],[],[],[],[],[],[],[],[],[],[],[],[],[],[],[],[],[],[],[],[],[],[],[],[],[],[],[],[],[],[],[],[],[],[],[],[],[],[],[],[],[],[],[],[],[],[],[],[],[],2021-12-07,2.5252100840336134
