2023-09-18,Using a VPN is easier than you might think. Here's a quick guide on how to turn off a VPN in just a few simple steps.,How To Turn Off A VPN In a Few Simple Steps,https://www.forbes.com/advisor/business/how-turn-off-vpn/,en,Forbes,"['Kiran Aditham', 'Updated', 'Oct']","Increasing internet speed: VPNs, by their very nature, may slightly decrease internet speed.
This is due to the process of data encryption and the path data travels via the VPN server.
If the decrease in speed becomes problematic, turning off the VPN might be a viable solution.
This is due to the process of data encryption and the path data travels via the VPN server.
Occasionally, you may experience connectivity issues while using a VPN, caused by server problems or conflicts with your internet service provider.",423,"['steps', 'service', 'data', 'turning', 'internet', 'turn', 'services', 'vpn', 'simple', 'speed', 'server', 'decrease', 'vpns']",[],[],[],[],[],[],[],[],[],[],[],[],[],[],[],[],[],[],[],[],[],[],[],[],[],[],[],[],[],[],[],[],[],[],[],[],[],[],[],[],[],[],[],[],[],[],[],[],[],[],[],2023-09-18,1.7773109243697478
2023-11-01,Discover the best Mac VPN in 2023. We analyzed Mac-compatible VPNs across a variety of different data points to present the best options.,Best Mac VPN In Canada For November 2023,https://www.forbes.com/advisor/ca/business/software/best-vpn-for-mac/,en,Forbes,"['Kathy Haan', 'Published', 'Nov', 'Aaron Broverman']","Kill switch: If the VPN connection drops, it’ll disconnect you from the internet.
This feature prevents your DNS requests from being exposed to your ISP, ensuring that your browsing history remains private even if the VPN connection fails.
Distance from the VPN server and the amount of traffic on that server can affect the speed of a VPN connection.
Bundles: Some VPN providers offer bundles that include other services, such as password managers or secure cloud storage, at a discounted rate.
Some VPN providers offer bundles that include other services, such as password managers or secure cloud storage, at a discounted rate.",1458,"['connection', '2023', 'providers', 'price', 'subscription', 'speed', 'vpn', 'server', 'features', 'mac', 'offers', 'canada', 'provider', 'best']",[],[],[],[],[],[],[],[],[],[],[],[],[],[],[],[],[],[],[],[],[],[],[],[],[],[],[],[],[],[],[],[],[],[],[],[],[],[],[],[],[],[],[],[],[],[],[],[],[],[],[],2023-11-01,6.126050420168068
2023-10-16,"Is using a VPN safe? When you research and find the best service, you will find the answer is a yes. Read how VPNs work & ways to choose the right one.",Is Using A VPN Safe? What You Need To Know About VPN Security,https://www.forbes.com/advisor/in/business/software/are-vpns-safe/,en,Forbes,"['Toni Matthews-El', 'Cassie Bottorff', 'Forbes Staff', 'Updated', 'Jul', 'Rob Watts']","How a VPN WorksWhen you use a VPN service, it essentially encodes and reroutes your personal data.
How To Choose a VPNIt is vital to note that not all VPN services are created equal.
Think about what you want and need from a VPN service and be sure the service provider you settle on checks everything off your list.
Think about what you want and need from a VPN service and be sure the service provider you settle on checks everything off your list.
Untrustworthy VPN Service ProvidersOne reason some VPN services are available for free is that the company makes its money by selling your data.",1533,"['using', 'data', 'access', 'services', 'vpn', 'servers', 'free', 'privacy', 'safe', 'need', 'vpns', 'service', 'information', 'security', 'know']",[],[],[],[],[],[],[],[],[],[],[],[],[],[],[],[],[],[],[],[],[],[],[],[],[],[],[],[],[],[],[],[],[],[],[],[],[],[],[],[],[],[],[],[],[],[],[],[],[],[],[],2023-10-16,6.4411764705882355
2023-11-02,Lo primero que debemos saber es que VPN es una red privada virtual que permite una conexión segura y cifrada entre dos redes o entre un usuario específico y una red,Cómo elegir la VPN Gratis perfecta: Guía completa de selección,https://www.cronica.com.mx/negocios/elegir-vpn-gratis-perfecta-guia-completa-seleccion.html,en,La Crónica de Hoy,[],,0,"['vpn', 'completa', 'la', 'perfecta', 'cómo', 'guía', 'selección', 'gratis', 'elegir']",[],[],[],[],[],[],[],[],[],[],[],[],[],[],[],[],[],[],[],[],[],[],[],[],[],[],[],[],[],[],[],[],[],[],[],[],[],[],[],[],[],[],[],[],[],[],[],[],[],[],[],2023-11-02,0.0
2023-10-16,VPNs are cybersecurity measures designed to protect your online identity safe from prying eyes. Know the latest VPN statistics & trends to watch out for.,VPN Statistics And Trends In 2023 – Forbes Advisor INDIA,https://www.forbes.com/advisor/in/business/vpn-statistics/,en,Forbes,"['Dipen Pradhan', 'Aashika Jain', 'Forbes Staff', 'Updated', 'Aug']","That said, it is perfectly legal to use VPN in India, however, committing illegal activities using a VPN is still illegal.
of Servers 30,000+ Buy Now On Private Internet Access' WebsiteHere’s the latest VPN statistics and trends in India and abroad to watch out for in 2023.
Overview: Key VPN Trends and Statistics in 2023A VPN hides the user’s actual public IP address and creates a secure tunnel between their device and the remote server.
Further studies on how people across the world access VPN point towards these major trends in 2023.
Various researches on global adoption of VPN point towards these major trends in 2023.",1505,"['trends', 'statistics', '2023', 'internet', 'free', 'access', 'users', 'servers', 'india', 'adoption', 'devices', 'data', 'vpn']",[],[],[],[],[],[],[],[],[],[],[],[],[],[],[],[],[],[],[],[],[],[],[],[],[],[],[],[],[],[],[],[],[],[],[],[],[],[],[],[],[],[],[],[],[],[],[],[],[],[],[],2023-10-16,6.323529411764706
2023-10-16,Apple TV doesn’t support VPN software apps but there are ways you can configure a secure VPN connection with it. Here’s how you can use VPN on Apple TV.,How To Setup VPN On Apple TV In 2023,https://www.forbes.com/advisor/in/business/software/how-to-setup-vpn-on-apple-tv/,en,Forbes,"['Chahat Awasthi', 'Published', 'Oct', 'Aashika Jain']","of Servers 30,000+ Buy Now On Private Internet Access' WebsiteWhy Should You Consider Using VPN on Apple TV?
As per Apple’s Sep. 18 2023 press release, tvOS 17 is now live and thanks to it, Apple TV now supports native VPN apps.
This means now you can directly download its VPN app on your Apple TV and start browsing.
Then, set up the VPN on a VPN-enabled router—This is how you use VPN services of devices that don’t support VPN apps, like Apple TV.
Smart DNS is a useful technology that can be manually set-up with your Apple TV.",771,"['price', 'internet', 'tv', '2023', 'servers', 'apple', 'network', 'website', 'monthly', 'setup', 'lowest', 'vpn']",[],[],[],[],[],[],[],[],[],[],[],[],[],[],[],[],[],[],[],[],[],[],[],[],[],[],[],[],[],[],[],[],[],[],[],[],[],[],[],[],[],[],[],[],[],[],[],[],[],[],[],2023-10-16,3.2394957983193278
2023-09-28,VPN provider Nord Security raises $100M at $3B valuation - SiliconANGLE,VPN provider Nord Security raises $100M at $3B valuation,https://siliconangle.com/2023/09/28/vpn-provider-nord-security-raises-100m-3b-valuation/,en,SiliconANGLE News,"['Kyt Dotson', 'Ryan Stevens', 'David Strom', 'Duncan Riley']",,0,"['vpn', 'provider', '100m', '3b', 'raises', 'valuation', 'nord', 'security']",[],[],[],[],[],[],[],[],[],[],[],[],[],[],[],[],[],[],[],[],[],[],[],[],[],[],[],[],[],[],[],[],[],[],[],[],[],[],[],[],[],[],[],[],[],[],[],[],[],[],[],2023-09-28,0.0
2023-09-20,There are many reasons to consider setting up a virtual private network (VPN) for your Sony PlayStation consoles. Here’s how to do so through various devices.,Playstation VPN Setup Guide – Forbes Advisor,https://www.forbes.com/advisor/business/playstation-vpn-setup/,en,Forbes,"['Leeron Hoory', 'Kiran Aditham', 'Published', 'Sep']","Installing a VPN to your router is likely the easiest way to set up a VPN not only for your PlayStation but for any other device that connects to the internet.
The process of configuring a VPN to your router will be different for each router and VPN provider.
VPN providers also sell routers with a VPN already preconfigured.
If you want to configure a VPN manually, the best way to go is to refer to the instructions on your VPN provider’s website.
VPN providers will typically also provide tech support.",184,"['wifi', 'router', 'way', 'support', 'process', 'providers', 'device', 'connects', 'routers', 'guide', '2023', 'playstation', 'setup', 'vpn']",[],[],[],[],[],[],[],[],[],[],[],[],[],[],[],[],[],[],[],[],[],[],[],[],[],[],[],[],[],[],[],[],[],[],[],[],[],[],[],[],[],[],[],[],[],[],[],[],[],['man'],[],2023-09-20,0.773109243697479
2023-10-16,"A VPN tunnel is a secure, encrypted connection between a user’s device and the internet via a virtual private network. Here’s what it is and how it works.",What Is A VPN Tunnel And How Does It Work?,https://www.forbes.com/advisor/in/business/what-is-vpn-tunnel/,en,Forbes,"['Monique Danao', 'Updated', 'Sep', 'Cassie Bottorff']","The VPN tunnel encrypts the user’s internet traffic and routes it to a remote VPN server.
The VPN tunnel encrypts the user’s internet traffic and routes it to a remote VPN server.
Also, the VPN tunnel helps to ensure all data’s confidentiality, integrity and authenticity as it travels across public networks.
Point-to-Point Tunneling Protocol (PPTP)Point-to-Point Tunneling Protocol (PPTP) is a VPN protocol used during the 1990s.
L2TP/IPSecL2TP/IPSec is a virtual private network (VPN) protocol that combines Layer 2 Tunneling Protocol (L2TP) and Internet Protocol Security (IPSec).",1639,"['server', 'secure', 'vpn', 'internet', 'protocol', 'tunneling', 'encrypted', 'work', 'users', 'does', 'tunnel', 'traffic']",[],[],[],[],[],[],[],[],[],[],[],[],[],[],[],[],[],[],[],[],[],[],[],[],[],[],[],[],[],[],[],[],[],[],[],[],[],[],[],[],[],[],[],[],[],[],[],[],[],[],[],2023-10-16,6.88655462184874
2023-11-03,Estas son los mejores servicios VPN y los más baratos para poder navegar sin que espíen lo que haces y pudiendo acceder a todo el contenido que desees sin restricció,Estas son las mejores VPN para usar en Argentina en 2023,https://computerhoy.com/internet/estas-son-mejores-vpn-usar-argentina-1329726,en,Computer Hoy,['Félix Palazuelos'],"Su aplicación para Android se actualiza constantemente y es una de las mejores VPN para casi todos los usuarios.
Proton VPNProtonDate de alta en Proton VPN Proton VPN es una de las mejores redes privadas virtuales del mundo, establecida en Suiza y con un cifrado ultraseguro.
Sus aplicaciones son muy buenas e intuitivas tanto en iOS como en Android, que es lo que nos interesa.
Es por lo tanto una de las VPN más baratas con diferencia, al menos entre las que ofrecen todas las garantías de privacidad y seguridad.
Su aplicación para Android te ofrece una VPN gratuita con 10GB de datos mensuales, y además es una de las más rápidas y fluidas de las mejores VPN para Android.",1610,"['usar', 'estas', 'es', 'vpn', 'una', 'y', 'en', 'más', 'que', 'los', 'son', 'para', 'argentina', '2023', 'mejores', 'las']",[],[],[],[],[],[],[],[],[],[],[],[],[],[],[],[],[],[],[],[],[],[],[],[],[],[],[],[],[],[],[],[],[],[],[],[],[],[],[],[],[],[],[],[],[],[],[],[],[],[],[],2023-11-03,6.764705882352941
2023-10-09,"Many Australian viewers use their VPN to access Netflix libraries in other countries, including the US, Japan and the UK. Here's how to do it.",How To Use A VPN For Netflix – Forbes Advisor Australia,https://www.forbes.com/advisor/au/business/software/watch-netflix-with-vpn/,en,Forbes,"['Prashant Mehra', 'Updated', 'Oct', 'Johanna Leggatt']","Netflix offers thousands of movies and series, but most Australian subscribers will only get access to a fraction of these titles.
That’s because libraries on the popular streaming service vary from country to country and you can only watch what is available in your geography.
That doesn’t necessarily mean you have to give up on a lot of popular content that isn’t available in your country.
One way to scour through Netflix’s vast international library of content is by using a virtual private network (VPN).
You can read more about the best VPNs for Australians in our guide.",125,"['vpn', 'international', 'way', 'available', 'vast', 'popular', 'watch', 'access', 'virtual', 'netflix', 'guide', 'country', 'content', 'vpns', 'shows']",[],[],[],[],[],[],[],[],[],[],[],[],[],[],[],[],[],[],[],[],[],[],[],[],[],[],[],[],[],[],[],[],[],[],[],[],[],[],[],[],[],[],[],[],[],[],[],[],[],['man'],[],2023-10-09,0.5252100840336135
2023-11-01,"When you want to protect your privacy online, but are browsing using a mobile device, Forbes Advisor has you covered with its best options for a mobile VPN.",Best Mobile VPN In Canada For November 2023,https://www.forbes.com/advisor/ca/business/software/best-mobile-vpn/,en,Forbes,"['Amy Nichol Smith', 'Christiana Jolaoso', 'Contributor', 'Published', 'Nov', 'Aaron Broverman']","There are three plans from which you can choose: Standard ($4.99 USD ($6.79 CAD)per month, paid annually), Plus ($5.79 USD ($7.88 CAD) per month, paid annually) or Complete ($6.99 USD ($9.52 CAD) per month, paid annually).
You can opt for a month-to-month plan, but you’ll pay $12.99 USD ($17.69 CAD) per month to $14.99 USD ($20.42 CAD) per month.
Alternatively, you can choose a two-year plan for more savings—$3.79 USD ($5.16 CAD) per month to $5.79 USD ($7.88 CAD) per month, paid annually.
The Plus plan gives you access to a password manager that syncs your passwords across all your devices―from your PC to your mobile phone.
Who should use it:NordVPN is one of the most popular VPNs around, and it’s one of the best mobile VPNs for beginners who aren’t tech-savvy or familiar with how a VPN works.",482,"['2023', 'annually', 'usd', 'best', 'paid', 'cad', 'vpns', 'month', 'mobile', 'vpn', 'nordvpn', 'canada', 'plus', 'plan']",[],[],[],[],[],[],[],[],[],[],[],[],[],[],[],[],[],[],[],[],[],[],[],[],[],[],[],[],[],[],[],[],[],[],[],[],[],[],[],[],[],[],[],[],[],[],[],[],[],[],[],2023-11-01,2.0252100840336134
2023-08-31,Information Services also will perform preliminary VPN maintenance tasks Sept. 7,"VPN will get Microsoft login, require Duo starting Sept. 19 | Around ...",https://around.uoregon.edu/content/vpn-will-get-microsoft-login-require-duo-starting-sept-19,en,AroundtheO,[],"This September, the University of Oregon's virtual private network will become more secure through an updated login sequence that includes Duo two-step login.
On Tuesday, Sept. 19, between 6 and 7 a.m., Information Services will make two simultaneous changes to UO VPN.
Duo verification will become required for access to UO VPN, as it is for Canvas, Zoom, UOmail, Microsoft 365 and many other UO services.
The UO VPN login screen will change to a Microsoft-branded window that opens in a browser, like what people see when logging in at office.uoregon.edu.
UO VPN allows students, staff and faculty members to securely connect to the UO campus network from off campus.",296,"['19', 'technology', 'duo', 'information', 'vpn', 'login', 'require', 'uo', 'service', 'sept', 'upgrade', 'university', 'microsoft', 'twostep', 'changes', 'starting']",[],[],[],[],[],[],[],[],[],[],[],[],[],[],[],[],[],[],[],[],[],[],[],[],[],[],[],[],[],[],[],[],[],[],[],[],[],[],[],[],[],[],[],[],[],[],[],[],[],[],[],2023-08-31,1.2436974789915967
2023-08-16,Weak points in VPNs have the potential to jeopardize your network privacy. Researchers have tipped off vendors to help ensure continued security.,TunnelCrack VPN Vulnerability Attacks Could Leak Data,https://www.forbes.com/advisor/business/tunnelcrack-attacks/,en,Forbes,"['Dawn Nici', 'Caren Weiner', 'Updated', 'Aug']","“Our tests indicate that every VPN product is vulnerable on at least one device,” the researchers wrote.
The testers confirmed their findings by running 248 experiments involving 67 VPN providers on Windows, macOS, iOS, Linux and Android.
Two types of vulnerabilities were discovered: LocalNet attacks and ServerIP attacks.
ServerIP attacks involve traffic being sent to and from the VPN server.
TunnelCrack vulnerabilities would allow bad actors to intercept and misdirect traffic using VPNs’ ordinary data transfer rules.",747,"['vpns', 'wifi', 'vpn', 'windows', 'vulnerability', 'security', 'researchers', 'leak', 'traffic', 'websites', 'attacks', 'tunnelcrack', 'vulnerable', 'data']",[],[],[],[],[],[],[],[],[],[],[],[],[],[],[],[],[],[],[],[],[],[],[],[],[],[],[],[],[],[],[],[],[],[],[],[],[],[],[],[],[],[],[],[],[],[],[],[],[],[],[],2023-08-16,3.138655462184874
2023-05-30,The legality of VPNs has sparked much debate as concerns over online privacy and government surveillance have continued to grow. Here’s what you should know.,Are VPNs Legal? The Worldwide Guide – Forbes Advisor,https://www.forbes.com/advisor/business/are-vpns-legal/,en,Forbes,"['Monique Danao', 'Cassie Bottorff', 'Contributor', 'Brette Sember', 'Updated', 'May']","Online content is regulated and authorities have the power to block social media platforms during periods of unrest or school examinations.
Individuals caught using VPNs to access restricted content may face severe penalties, such as fines worth $1,300.
All VPN services must operate within the “legal framework” approved by the government.
Despite these restrictions, many Russians still use VPNs to access restricted content and communicate securely.
The repressive nation has banned social media services including Facebook, WhatsApp, Twitter, Viber and famous Russian networks such as Odnoklassniki and VKontakte.",817,"['restricted', 'legal', 'internet', 'access', 'services', 'vpns', 'worldwide', 'media', 'vpn', 'guide', 'online', 'content', 'social']",[],[],[],[],[],[],[],[],[],[],[],[],[],[],[],[],[],[],[],[],[],[],[],[],[],[],[],[],[],[],[],[],[],[],[],[],[],[],[],[],[],[],[],[],[],[],[],[],[],[],[],2023-05-30,3.4327731092436973
