publishedAt,description,title,URL,language,mediaTitle,authors,summary,textLength,keywords,cancerTypes_breast,cancerTypes_prostate,cancerTypes_colorectal,cancerTypes_hodgkin,cancerTypes_pediatric,cancerTypes_bone,cancerTypes_rare,cancerTypes_melanoma,cancerTypes_lung,cancerTypes_pancreatic,cancerTypes_stomach,cancerTypes_bladder,cancerTypes_non-hodgkin,cancerTypes_liver,cancerTypes_kidney,cancerTypes_multiple myeloma,cancerTypes_thyroid,cancerTypes_oral cavity,cancerTypes_esophagus,cancerTypes_larynx,cancerTypes_corpus uteri,cancerTypes_ovarian,cancerTypes_endometrial,cancerTypes_testicular,cancerTypes_neuroblastoma,cancerTypes_wilms,thematicAreas_adverseEvents,thematicAreas_nutrition,thematicAreas_mentalHealth,thematicAreas_qol,thematicAreas_jobSecurityAccessToEmployment,thematicAreas_survivorshipCare,thematicAreas_AYACare,thematicAreas_lateEffects,thematicAreas_wellbeing,thematicAreas_meditation,thematicAreas_co-morbidity,thematicAreas_rehabilitation,thematicAreas_physicalActivity,thematicAreas_socialRehabilitation,thematicAreas_sexualLife,thematicAreas_lifeStyle,thematicAreas_empowermentOfCancerSurvivorship,thematicAreas_inequalitiesInSurvivorship,thematicAreas_prevention,thematicAreas_cancerInformation,thematicAreas_personalExperiences,targetGroups_adult,targetGroups_child,targetGroups_man,targetGroups_woman,time,duration
2023-11-02,The privacy-focused infrastructure project says that the new NymVPN will disperse traffic across a network of nodes rather than running data through single servers as centralized VPNs do.,Privacy Technology Firm Nym Plans Early 2024 Rollout of 'Decentralized VPN',https://www.coindesk.com/tech/2023/11/02/nym-plans-early-2024-rollout-of-decentralized-vpn/,en,CoinDesk,[],"""This brings together a decentralized VPN and a mixnet on the same network to offer users the highest level of privacy and security for all their online activities,"" according to a press release.
""Unlike centralized VPNs, which funnel all your data through a single server, the NymVPN disperses your traffic across a network of nodes.""",55,"['unlike', '2024', 'privacy', 'firm', 'security', 'vpns', 'plans', 'traffic', 'technology', 'single', 'nym', 'release', 'server', 'users', 'early', 'rollout', 'vpn', 'network', 'decentralized']",[],[],[],[],[],[],[],[],[],[],[],[],[],[],[],[],[],[],[],[],[],[],[],[],[],[],[],[],[],[],[],[],[],[],[],[],[],[],[],[],[],[],[],[],[],[],[],[],[],[],[],2023-11-02,0.23109243697478993
2023-11-02,"A vulnerability of medium severity, identified as CVE-2023-20042, with a CVSS score of 6.8, was found in the AnyConnect SSL VPN feature of Cisco Adaptive Security Appliance (ASA) Software and Cisco Firepower Threat Defence (FTD) Software.",Cisco AnyConnect SSL VPN Flaw Let Attacker Launch DoS Attack,https://gbhackers.com/cisco-anyconnect-ssl-vpn-flaw/,en,GBHackers,"['Balaji Is An Ex-Security Researcher', 'Threat Research Labs', 'At Comodo Cybersecurity. Editor-In-Chief', 'Co-Founder - Cyber Security News', 'Gbhackers On Security.']","A vulnerability of medium severity, identified as CVE-2023-20042, with a CVSS score of 6.8, was found in the AnyConnect SSL VPN feature of Cisco Adaptive Security Appliance (ASA) Software and Cisco Firepower Threat Defence (FTD) Software.
This vulnerability could potentially enable an unauthenticated, remote attacker to cause a denial of service (DoS) condition.
Details of the Cisco AnyConnect SSL VPN FlawAn implementation issue in the SSL/TLS session handling procedure, which could prevent the release of a session handler under certain circumstances, is the cause of the vulnerability discovered.
Affected ProductsCisco stated that this flaw impacted Cisco ASA and FTD software that had been configured for AnyConnect SSL/TLS VPN connections.
Indicators of CompromiseAccording to Cisco, the command shows SSL objects may be used to identify the presence of leaking session handlers.",316,"['vpn', 'session', 'plus', 'anyconnect', 'software', 'launch', 'ssltls', 'attacker', 'thirdparty', 'let', 'patch', 'attack', 'vulnerability', 'cisco', 'ssl', 'flaw', 'dos']",[],[],[],[],[],[],[],[],[],[],[],[],[],[],[],[],[],[],[],[],[],[],[],[],[],[],[],[],[],[],[],[],[],[],[],[],[],[],[],[],[],[],[],[],[],[],[],[],[],[],[],2023-11-02,1.3277310924369747
2023-11-02,Google Play is more prominently surfacing independent security reviews as a banner when searching for VPN apps...,Google Play highlighting VPNs that have undergone security review,https://9to5google.com/2023/11/02/google-play-vpn-security-review/,en,9to5Google,"['Abner Li', 'Ben Schoon', 'Andrew Romero']","One aspect of the Data Safety section that the Play Store introduced last year is the ability to feature “Independent security reviews.” Google Play is more prominently surfacing that badge when you search for VPN apps.
Google is now telling Android users to look for this Independent Security Review badge when they search for a VPN.
Tapping “Learn More” takes you to the App Validation Directory to “view all VPN apps that have been independently security reviewed” and find additional technical assessment details.
We encourage and anticipate additional VPN app developers to undergo independent security testing, bringing even more transparency to users.
Google acknowledges that baseline security standards don’t “imply that a product is free of vulnerabilities” but hopes the “badge associated with these validated apps helps users see at-a-glance that a developer has prioritized security and privacy practices and committed to user safety.”More on Google Play:",305,"['developers', 'validated', 'highlighting', 'undergone', 'apps', 'independent', 'vpn', 'security', 'vpns', 'badge', 'review', 'users', 'play', 'google']",[],[],[],[],[],[],[],[],[],[],[],[],[],[],[],[],[],[],[],[],[],[],[],[],[],[],[],[],[],[],[],[],[],[],[],[],[],[],[],[],[],[],[],[],[],[],[],[],[],[],[],2023-11-02,1.281512605042017
2023-11-02,More than 167 VPNs have already reportedly been blocked in Russia. How could HideMyName's victory in Court affect this trend?,First ever Russia VPN lawsuit filed against Kremlin's censorship machine,https://www.techradar.com/computing/cyber-security/first-ever-russia-vpn-lawsuit-filed-against-kremlins-censorship-machine,en,TechRadar,"['Chiara Castro', 'Senior Staff Writer', 'Social Links Navigation']","A VPN in Russia has just become the first ever provider to file a lawsuit against the Kremlin's infamous censorship body regulator.
No traces of the VPN service's domain name on Roskomnadzor's list of blocking sites could be found either.
The VPN provider decided to then take things into its own hands.
According to decisions of different courts, websites of VPN services were blocked at different times, but you could still download the application and safely use the VPN service.""
(Image credit: Getty Images)HideMyName is just one of the many VPN services to have encountered the iron fist of the Kremlin censorship machine.",605,"['lawsuit', 'machine', 'services', 'censorship', 'russian', 'russia', 'filed', 'blocking', 'kremlins', 'legal', 'provider', 'protocol', 'vpn']",[],[],[],[],[],[],[],[],[],[],[],[],[],[],[],[],[],[],[],[],[],[],[],[],[],[],[],[],[],[],[],[],[],[],[],[],[],[],[],[],[],[],[],[],[],[],[],[],[],[],[],2023-11-02,2.542016806722689
2023-11-03,Google has added a new security banner to the Google Play Store that shows you which apps have been verified by a third party security assessment.,Sceptical about that free VPN app? Google Play Store will now tell you if it’s secure,https://indianexpress.com/article/technology/tech-news-technology/google-play-store-security-banner-vpn-apps-9011627/,en,The Indian Express,"['Var Template_Content', 'Sso_Login_Box', 'Xwelcome Backorenter The Email Address Or Mobile Number Associated With Your Account To Sign In. Show Passwordsign Innew To The Indian Express Signupxcreate Your Account It Is Quick', 'Easy.Or Show Passwordnextvalidate Otpregisteralready Have An Account', 'Signin', 'Sso_Social_Box', 'Sign In Withgmailfacebookapple', 'Var Follow_Widget_Data', 'Af_Article_Count', 'Ie_Mobile_Check']","Starting today, Google is rolling out a new security banner for certain types of apps in the Google Play Store.
The banner will show you which apps have been verified by the Mobile App Security Assessment (MASA), a standard that Google introduced last year to evaluate the security and privacy practices of mobile apps.
The banner will first appear for VPN apps, which handle a lot of sensitive and personal data from users.
The banner will explain that the app has been validated for the minimum global security standard, and it will display a badge that indicates the app’s MASA status.
You can also find the badge in the data safety section of the app, where you can learn more about how the app protects your data.",127,"['banner', 'apps', 'vpn', 'app', 'play', 'tell', 'free', 'standard', 'security', 'masa', 'secure', 'badge', 'mobile', 'google', 'sceptical', 'store', 'data']",[],[],[],[],[],[],[],[],[],[],[],[],[],[],[],[],[],[],[],[],[],[],[],[],[],[],[],[],[],[],[],[],[],[],[],[],[],[],[],[],[],[],[],[],[],[],[],[],[],[],[],2023-11-03,0.5336134453781513
2023-11-02,"Google announced that it is adding a new banner to the Google Play store for specific app types, starting with VPNs.",Is that VPN app on the Play Store safe? Google will now help inform you.,https://www.androidauthority.com/google-play-store-vpn-3381728/,en,Android Authority,[],"Edgar Cervantes / Android AuthorityTL;DR Google is introducing a new banner in the Google Play store for specific app types.
Last month, Google announced it was introducing real-time app scanning to Google Play Protect for Android app installs.
Now the company is making it easier to see which apps have undergone an independent security review in the Google Play store.
Today, Google announced that it is adding a new banner to the Google Play store for specific app types.
The security review is conducted by a third party using the Mobile App Security Assessment (MASA), an assessment that was introduced last year.",301,"['play', 'vpn', 'app', 'security', 'safe', 'apps', 'banner', 'store', 'user', 'review', 'independent', 'help', 'inform', 'google', 'assessment']",[],[],[],[],[],[],[],[],[],[],[],[],[],[],[],[],[],[],[],[],[],[],[],[],[],[],[],[],[],[],[],[],[],[],[],[],[],[],[],[],[],[],[],[],[],[],[],[],[],[],[],2023-11-02,1.2647058823529411
2023-11-02,A Swiss startup named Nym will soon launch a decentralised VPN. The company expects the tech to eventually go mainstream.,A new decentralised VPN aims to patch a gaping security hole,https://thenextweb.com/news/nym-accounces-decentralised-vpn-privacy-protection,en,TNW,"['Thomas Macaulay', 'Story By']","Instead of funnelling all user data through a single server, they disperse the traffic across a network run by multiple users.
The Swiss startup today announced that it will launch a new decentralised (dVPN) in the first quarter of next year.
Each of these operators routs a user’s internet traffic through various stages of the information pathway, known as hops.
The internet internet may come to look like a very different place.
The value of the worldwide data privacy market, meanwhile, is projected to reach $30bn by 2030.",870,"['user', 'vpn', 'data', 'vpns', 'nym', 'aims', 'brekke', 'online', 'patch', 'traffic', 'hole', 'privacy', 'security', 'internet', 'gaping', 'decentralised']",[],[],[],[],[],[],[],[],[],[],[],[],[],[],[],[],[],[],[],[],[],[],[],[],[],[],[],[],[],[],[],[],[],[],[],[],[],[],[],[],[],[],[],[],[],[],[],[],[],[],[],2023-11-02,3.6554621848739495
2023-11-02,"Nym Technologies, the privacy infrastructure project with backing from a16z and Chelsea Manning, shares the release of its decentraized VPN for Q1 2024, which is said to disperse user traffic across a network of nodes.",Chelsea Manning-backed Nym releases privacy-first VPN powered ...,https://crypto.news/chelsea-manning-backed-nym-releases-privacy-first-vpn-powered-by-blockchain/,en,crypto.news,"['Sarah Jansen', 'Brian Stone']","Nym Technologies, the privacy infrastructure project with backing from a16z and Chelsea Manning, shares the release of its decentraized VPN for Q1 2024, which is said to disperse user traffic across a network of nodes.
Alongside this launch, the project is also releasing the VPN’s lightpaper, providing insights into the solution’s privacy mechanism.
Enhancing online privacyIn a Nov. 2 announcement shared with crypto.news, the contrast is highlighted between conventional centralized VPN services that channel data through a single server and the NymVPN, which employs a decentralized approach, distributing user traffic across a network of nodes.
The architectural change is said to enhance online privacy, rendering it more difficult for potential eavesdroppers to monitor user activities.
At the time, Halpin shared that Manning could help Nym fix holes in its design.",251,"['nym', 'chelsea', 'privacy', 'technologies', 'traffic', 'shared', 'releases', 'user', 'users', 'powered', 'manning', 'privacyfirst', 'online', 'blockchain', 'vpn', 'manningbacked']",[],[],[],[],[],[],[],[],[],[],[],[],[],[],[],[],[],[],[],[],[],[],[],[],[],[],[],[],[],[],[],[],[],[],[],[],[],[],[],[],[],[],[],[],[],[],[],[],[],['man'],[],2023-11-02,1.0546218487394958
2023-11-01,,ReasonLabs Unveils RAV VPN for Apple iOS,https://www.darkreading.com/endpoint/reasonlabs-unveils-rav-vpn-for-apple-ios,en,Dark Reading,"['Becky Bracken', 'Editor', 'Dark Reading', 'Kristina Beek', 'Associate Editor', 'Nate Nelson', 'Contributing Writer']","As Wi-Fi security is a common unresolved issue in many households, with RAV VPN, Apple iPhone users can enjoy a secured encrypted connection to any Wi-Fi network.
You can download RAV VPN for iOS on the App Store here.
RAV VPN enables iOS users to safeguard their online activities and protect sensitive data from prying eyes.
""RAV VPN for iOS empowers users to take control of their online experiences, ensuring they can connect online with confidence and peace of mind.
For more information about RAV VPN for iOS, Android, or Windows, and ReasonLabs' other products and services, please visit www.reasonlabs.com.",396,"['rav', 'ios', 'reasonlabs', 'vpn', 'security', 'unveils', 'users', 'protection', 'apple', 'products', 'cybersecurity', 'online']",[],[],[],[],[],[],[],[],[],[],[],[],[],[],[],[],[],[],[],[],[],[],[],[],[],[],[],[],[],[],[],[],[],[],[],[],[],[],[],[],[],[],[],[],[],[],[],[],[],[],[],2023-11-01,1.6638655462184875
2023-10-11,A VPN protocol provides a secure tunnel for data transmission to keep your online activities confidential. Learn about six common VPN protocols.,X Common VPN Protocols Explained – Forbes Advisor,https://www.forbes.com/advisor/business/software/vpn-protocols/,en,Forbes,"['Monique Danao', 'Kiran Aditham', 'Published', 'Oct']","VPN protocols are used to establish secure and encrypted connections between a user’s device and a VPN server.
Here are some of the most common types of VPN protocols.
L2TP/IPsecL2TP/IPsec is a virtual private network (VPN) protocol that is a combination of two protocols—layer 2 tunneling protocol (L2TP) and internet protocol security (IPsec).
PPTP is one of the earliest VPN protocols but it still relies on the outdated MS-CHAP v2 to transmit data.
While it supports other platforms—macOS, Linux or mobile devices—may be more limited compared to other VPN protocols.",795,"['protocols', 'explained', 'vpn', 'data', 'encryption', 'pptp', 'devices', 'secure', 'common', 'security', 'protocol', 'windows']",[],[],[],[],[],[],[],[],[],[],[],[],[],[],[],[],[],[],[],[],[],[],[],[],[],[],[],[],[],[],[],[],[],[],[],[],[],[],[],[],[],[],[],[],[],[],[],[],[],[],[],2023-10-11,3.3403361344537816
2023-10-20,We reveal our picks for the best VPNs for those traveling through Turkey.,Best VPN For Turkey Of 2023 – Forbes Advisor,https://www.forbes.com/advisor/business/software/best-vpn-turkey/,en,Forbes,"['Kathy Haan', 'Published', 'Oct', 'Rob Watts']","Why We Picked ItNordVPN stands as a formidable choice when considering VPN services catered specifically to the unique digital landscape of Turkey.
Its network isn’t just impressive; it’s extensive, featuring 5,664 servers across 60 countries, giving Turkish users an abundance of connection alternatives for ideal speed and reliability.
NordVPN’s appeal extends beyond the ordinary VPN services with its innovative features.
To hide VPN use from internet service providers (ISPs), NordVPN offers Turkish users protocols, such as OpenVPN UDP/TCP, IKEv2/IPsec, NordLynx and obfuscated servers.
Who should use it:NordVPN is best for users seeking a blend of online security, fast connection speeds and a variety of powerful VPN features.",208,"['features', 'best', 'services', 'nordvpn', 'online', 'vpn', 'internet', 'turkish', 'speed', 'turkey', 'users', 'protection', '2023']",[],[],[],[],[],[],[],[],[],[],[],[],[],[],[],[],[],[],[],[],[],[],[],[],[],[],[],[],[],[],[],[],[],[],[],[],[],[],[],[],[],[],[],[],[],[],[],[],[],[],[],2023-10-20,0.8739495798319328
2023-10-23,A remote access VPN allows users to securely connect to a private network from a remote location over the internet. Learn the benefits and risks.,What Is A Remote Access VPN? – Forbes Advisor,https://www.forbes.com/advisor/business/what-is-remote-access-vpn/,en,Forbes,"['Kiran Aditham', 'Shweta', 'Contributor', 'Published', 'Oct']","A remote access VPN is a technology that allows users to securely connect to a private network from a remote location over the internet.
It operates on the principle of creating a secure “tunnel” over the public internet to connect a remote user with a private network.
This process begins when the user initiates a connection to the VPN server, usually by launching a software client on their device.
Through this encrypted tunnel, the user’s data is securely transmitted.
This mechanism allows for safe and remote access to resources while maintaining the security and integrity of the data.",201,"['private', 'user', 'users', 'server', 'access', 'tunneling', 'tunnel', 'network', 'remote', 'vpn', 'data']",[],[],[],[],[],[],[],[],[],[],[],[],[],[],[],[],[],[],[],[],[],[],[],[],[],[],[],[],[],[],[],[],[],[],[],[],[],[],[],[],[],[],[],[],[],[],[],[],[],[],[],2023-10-23,0.8445378151260504
2023-10-17,"Split tunneling offers a sophisticated method for directing specific internet traffic through a VPN. Learn how it works, the types, and when you should use it.",What Is VPN Split Tunneling? – Forbes Advisor,https://www.forbes.com/advisor/business/what-is-vpn-split-tunneling/,en,Forbes,"['Kiran Aditham', 'Published', 'Oct']","It’s crucial to understand your needs and potential security risks when deciding which type of split tunneling to use.
Application-based Split TunnelingThis is perhaps the most common way users interact with split tunneling.
Address-based Split TunnelingHere, split tunneling is determined based on destination IP addresses or IP ranges.
Inverse Split TunnelingThis is somewhat the opposite of traditional split tunneling.
URL-based Split TunnelingSome advanced VPN solutions allow for split tunneling based on specific URLs or domain names.",325,"['split', 'specific', 'ip', 'based', 'type', 'route', 'traffic', 'vpn', 'web', 'tunneling']",[],[],[],[],[],[],[],[],[],[],[],[],[],[],[],[],[],[],[],[],[],[],[],[],[],[],[],[],[],[],[],[],[],[],[],[],[],[],[],[],[],[],[],[],[],[],[],[],[],[],[],2023-10-17,1.365546218487395
2023-10-26,TorGuard is an ideal VPN to help you stay safe & maintain your privacy while accessing your favorite content without restriction. Read a detailed review.,"TorGuard VPN Review 2023: Features, Pricing & More – Forbes ...",https://www.forbes.com/advisor/in/business/software/torguard-review/,en,Forbes,"['Christiana Jolaoso', 'Updated', 'Oct', 'Kelly Main']","However, TorGuard VPN protects your IP address by conducting relevant transfers through its tunnels.
TorGuard VPN offers users multiple DNS and IPv6 leak protection measures, including OpenDNS, Level3 and Cloudflare.
We ran DNS test leaks on TorGuard VPN and confirmed that you’re leak-safe connecting to this VPN.
TorGuard VPN also allows you to earmark IP locations and switch between dedicated and shared IPs in only a few clicks.
TorGuard VPN also offers users a “network kill” feature that shuts down their internet once the VPN is disconnected.",395,"['features', 'offers', 'ips', 'internet', '2023', 'feature', 'pricing', 'users', 'torguard', 'review', 'apps', 'ip', 'dns', 'vpn']",[],[],[],[],[],[],[],[],[],[],[],[],[],[],[],[],[],[],[],[],[],[],[],[],[],[],[],[],[],[],[],[],[],[],[],[],[],[],[],[],[],[],[],[],[],[],[],[],[],[],[],2023-10-26,1.6596638655462186
2023-10-12,Using a VPN lets you dodge website blockers & firewalls. But how are they relevant & how to set up and use a VPN? Read this guide to know all about VPNs.,How To Setup VPN On Android In 2023 – Forbes Advisor INDIA,https://www.forbes.com/advisor/in/business/software/how-to-setup-vpn-on-android/,en,Forbes,"['Sarah Jain', 'Published', 'Oct', 'Aashika Jain']","How to Install VPN on an Android Device Without an AppAn alternate way to set up a VPN does not require you to download an application.
Connecting to a VPN on an android device:Step 1: Open Android SettingsStep 2: Open Network & InternetStep 3: Open Advanced SettingsStep 4: Click on VPNStep 5: Switch on the VPN toggle button in your settingsDisconnecting to a VPN on an android device:Step 1: Open Android SettingsStep 2: Open Network & InternetStep 3: Open Advanced SettingsStep 4: Click on VPNStep 5: Click on the saved VPN you want to disconnect with.
Step 7: Switch off the VPN toggle button in your settingsWhy You Need a VPN for AndroidUsing a VPN on an Android phone is highly recommended to protect your privacy and data as it establishes a secure connection between you and the VPN server.
This means that by connecting to a VPN server in a different country, you can access censored content in your country.
Furthermore, with built-in VPN features on Android phones and VPN applications on Google Play Store, it is super easy to set up and use a VPN.",1382,"['secure', 'set', 'internet', 'server', 'vpns', 'open', 'setup', '2023', 'vpn', 'using', 'android', 'browsing']",[],[],[],[],[],[],[],[],[],[],[],[],[],[],[],[],[],[],[],[],[],[],[],[],[],[],[],[],[],[],[],[],[],[],[],[],[],[],[],[],[],[],[],[],[],[],[],[],[],[],[],2023-10-12,5.80672268907563
2023-10-26,A VPN adds that extra layer of security but it also slows down your internet. Know how the degree of slowdown varies and is influenced by multiple factors.,Does A VPN Slow Down Your Internet? – Forbes Advisor INDIA,https://www.forbes.com/advisor/in/business/software/does-vpn-slow-down-internet/,en,Forbes,"['Published', 'Oct', 'Kiran Aditham']","Impact of Distance Between User and VPN ServerYour internet speed can be significantly impacted due to the distance between you and the VPN server.
Impact of VPN Server Quality and CongestionYour internet speed can also be affected due to the quality of a VPN server and its current load.
Factors that Affect the Impact of a VPN on Internet SpeedIt’s important to consider multiple variables to understand the impact of a VPN on your internet speed.
Internet SpeedWhen you use a VPN, the speed offered by your internet service provider (ISP) forms the basis of your internet experience.
How to Minimize VPN Impact on Internet SpeedYou can significantly minimize the impact of VPN speed on your internet by employing some strategic measures without compromising on security.",2003,"['encryption', 'servers', 'data', 'device', 'test', 'internet', 'vpn', 'slow', 'reset', 'server', 'speed', 'does']",[],[],[],[],[],[],[],[],[],[],[],[],[],[],[],[],[],[],[],[],[],[],[],[],[],[],[],[],[],[],[],[],[],[],[],[],[],[],[],[],[],[],[],[],[],[],[],[],[],[],[],2023-10-26,8.415966386554622
2023-11-02,"ExpressVPN, the British Virgin Islands-based consumer privacy and security company, has grown its server network to 105 countries, including Bermuda.
In addition to the island, ExpressVPN said the sig...",BVI-based Express VPN adds Bermuda server to network,https://www.royalgazette.com/international-business/business/article/20231102/bvi-based-express-vpn-adds-bermuda-server-to-network/,en,Royal Gazette,[],"Bermuda server: Express VPN is based in the British Virgin Islands (File photograph)ExpressVPN, the British Virgin Islands-based consumer privacy and security company, has grown its server network to 105 countries, including Bermuda.
The new ad blocker and adult-site blocker are available now on ExpressVPN's apps for Android, iOS, and Windows.
They will be available on Linux and Mac by the end of this year, the company said.
ExpressVPN said users can now connect up to eight devices simultaneously with a single subscription, up from the five-device limit previously offered.
It added that users who wish to connect unlimited devices, including smart home devices that aren't usually compatible with VPN software, can do so via ExpressVPN's Aircove router.",281,"['ways', 'bermuda', 'blocker', 'virgin', 'devices', 'service', 'express', 'bvibased', 'server', 'users', 'company', 'adds', 'network', 'expressvpns', 'vpn']",[],[],[],[],[],[],[],[],[],[],[],[],[],[],[],[],[],[],[],[],[],[],[],[],[],[],[],[],[],[],[],[],[],[],[],[],[],[],[],[],[],[],[],[],[],[],[],[],[],[],[],2023-11-02,1.180672268907563
